"No","URL","実タイトル","SEO改善タイトル案","推奨カテゴリ","推奨タグ"
"1","https://www.seiribu.site/home-cleanout/","実家の片付けは何から始める？売る・残す・処分の整理手順","実家の片付けはどこから始める？売る・残す・処分を判断する整理ガイド","実家の整理","実家の片付け, 仕分け, 売る・残す・処分"
"2","https://www.seiribu.site/rural-family-home-vacancy/","田舎の実家じまい、どうする？先延ばしが招く恐ろしい4つのリスク！","田舎の実家が空き家に。片付けと活用・処分の選択肢","実家の整理","実家じまい, 空き家, 実家の片付け"
"3","https://www.seiribu.site/trusted-buying-services/","信頼できる買取業者の見分け方！正しく選んでトラブルを避けよう","不用品買取はどこがいい？安心して選ぶための比較ポイント","買取トラブル対策","業者選び, 不用品買取, 訪問買取"
"4","https://www.seiribu.site/minimalist-personality/","「ミニマリストの性格の傾向」とは？向いている人・向いていない人","ミニマリストの人の特徴とは？性格・考え方・向いている人","家族と心の整理","ミニマリスト, 性格, 物を減らす"
"5","https://www.seiribu.site/sellable-disused-items/","捨てるのちょっと待った！実家の片付けで意外と売れるもの12選","実家にある売れるもの一覧｜片付け前に確認したい品物と買取の目安","売れる物","売れるもの, 実家の片付け, 不用品買取"
"6","https://www.seiribu.site/stress-of-dirty-room/","部屋が散らかっているとストレスが溜まりイライラする科学的根拠とは","部屋が汚いとストレスがたまる理由と、片付けを始める小さなコツ","家族と心の整理","ストレス, 部屋が汚い, 心の状態"
"7","https://www.seiribu.site/untidy-mother/","実家の片付けをしたいけど母が片付けられない場合どう対処したらいい？","実家の母が片付けられないとき、子どもができる現実的な対応","家族と心の整理","親が片付けられない, 家族の悩み, 実家の片付け"
"8","https://www.seiribu.site/sell-used-books/","中古で売れる本と売れない本の違いとは？高く売るコツから賢い処分方法まで","古本を高く売るには？本の買取前に確認したいポイント","売れる物","古本, 高く売る, 不用品買取"
"9","https://www.seiribu.site/husband-who-cant-get-rid-of-things/","どうしてウチの夫はモノを捨てられない？片付けられない夫の気持ちを解説！","物を捨てられない夫にイライラするときの考え方と話し合い方","家族と心の整理","捨てられない, コレクター, 家族の悩み, 趣味"
"10","https://www.seiribu.site/avoid-trouble/","危険！悪質な訪問買取業者の怪しい特徴【5選】トラブルを避けるための対策","訪問買取でトラブルを避けるには？安心して依頼するための注意点","買取トラブル対策","訪問買取, 悪質業者, 業者選び"
"11","https://www.seiribu.site/siblings-share/","実家の片付けの兄弟分担、結局自分ばかり？解決のコツと具体策","実家の片付けを兄弟で分担するには？揉めない進め方と役割分担","実家の整理","兄弟分担, 家族の悩み, 実家の片付け"
"12","https://www.seiribu.site/waste-collectors-steal/","遺品整理でネコババされる心配は?業者の選び方と対策まとめ","遺品整理業者が盗むことはある？トラブルを防ぐための確認ポイント","買取トラブル対策","遺品整理, 業者選び, 悪質業者"
"13","https://www.seiribu.site/not-for-purchase/","「買取基準に満たない」とは？買取不可の理由と対策を徹底解説","買取できない不用品とは？売れない理由と処分前の確認ポイント","処分と買取不可","買取不可, 不用品買取, 処分方法"
"14","https://www.seiribu.site/difference-between-useful-useless-items/","【素朴な疑問】不用品と不要品の違いとは？正しく理解して適切に処分しよう","いらないものと使わないものの違い｜片付けで迷ったときの判断基準","処分と買取不可","不用品回収, 処分方法, 仕分け"
"15","https://www.seiribu.site/only-child/","一人っ子が実家の片付けをするのは負担！親との話し合いと説得のコツ","一人っ子の実家の片付けはどう進める？親との話し合いと準備","実家の整理","一人っ子, 親との話し合い, 実家の片付け"
"16","https://www.seiribu.site/organizing-before-death/","生前整理とは？親の気持ちを理解して始める、実家の片付け方","親が元気なうちに始める実家の整理｜生前整理の進め方","実家の整理","生前整理, 親との話し合い, 実家の片付け"
"17","https://www.seiribu.site/declutter-parents-house-frustration/","実はみんな悩んでいる！実家の物が多すぎてイライラした時の対処法","実家の片付けにイライラする理由と、親と衝突しない進め方","家族と心の整理","物が多い, ストレス, 家族の悩み, 実家の片付け"
"18","https://www.seiribu.site/sell-someday/","売れると思うと捨てられない？大事なものを「捨てずに」処分する方法","「いつか売れるかも」と思って捨てられない物との向き合い方","家族と心の整理","捨てられない, 売れるもの, 心の状態, コレクター"
"19","https://www.seiribu.site/why-decluttering-seems-crazy/","断捨離をする人が「頭おかしい」と思われがちな理由と正しい取り組み方","断捨離がやばいと言われる理由と、無理なく物を減らす考え方","家族と心の整理","断捨離, 心の状態, ミニマリスト"
"20","https://www.seiribu.site/parent-wont-let-go-of-things/","親が物を捨てさせてくれないときの上手なコミュニケーション方法","親が物を捨てないとき、子どもはどう向き合うべきか","家族と心の整理","親との話し合い, 家族の悩み, 捨てられない"
"21","https://www.seiribu.site/psychology-of-decluttering/","急に物を減らしたくなる心理とは？心理学的な視点から考察してわかること","片付けられない心理とは？物を手放せない理由と対処法","家族と心の整理","心理学, 心の状態, 物を減らす"
"22","https://www.seiribu.site/reduce-things/","物を減らすと楽になる！疲れている人はぜひ一度試してほしい","物を減らすには何から始める？無理なく続ける整理のコツ","家族と心の整理","物を減らす, 心の状態, 断捨離"
"23","https://www.seiribu.site/why-hoard-things/","物を捨てられない男性の心理とは？気持ちに共感して家族が助ける方法","物を捨てられない人の心理とは？夫や父親など男性に多い理由と接し方","家族と心の整理","捨てられない, コレクター, 趣味, 家族の悩み"
